{
    "schemaVersion":  1,
    "id":  "english-card-17-spoken",
    "version":  1,
    "title":  "Performance evidence — spoken follow-up",
    "level":  "B2",
    "durationMinutes":  10,
    "skills":  [
                   "english.spoken",
                   "performance.evidence"
               ],
    "situation":  "In a technical discussion, an optimization is said to be twice as fast. You must answer aloud accurately without overstating the evidence.",
    "instructions":  [
                         "Deliver a sixty-second answer with decision, evidence, limitation and one clarifying question."
                     ],
    "vocabulary":  [
                       {
                           "term":  "benchmark evidence",
                           "meaning":  "the precise concept required for performance evidence"
                       },
                       {
                           "term":  "verified evidence",
                           "meaning":  "an observation supported by a reproducible check"
                       }
                   ],
    "expectedElements":  [
                             "A clear decision tied to the scenario",
                             "Verified evidence and one explicit limitation",
                             "One useful clarifying question"
                         ],
    "modelAnswer":  "My decision is that The claim needs the same scenario, workload, environment and measurement method before and after, plus unchanged functional tests. The current evidence is limited to the documented checks, so I would not claim more. Which constraint or observation would make us revisit this decision?",
    "commonMistakes":  [
                           "Using confident adjectives without naming evidence or a limitation"
                       ],
    "variants":  [
                     "Answer again after the reviewer changes one cost or security constraint."
                 ],
    "license":  "CC-BY-4.0"
}
