{
    "schemaVersion":  1,
    "id":  "english-card-07-written",
    "version":  1,
    "title":  "Cost warning — written update",
    "level":  "B1",
    "durationMinutes":  12,
    "skills":  [
                   "english.written",
                   "azure.cost"
               ],
    "situation":  "In a technical discussion, a manager asks whether a budget guarantees zero overspend. You must write the decision accurately without overstating the evidence.",
    "instructions":  [
                         "Write a four-sentence update with decision, evidence, limitation and next action."
                     ],
    "vocabulary":  [
                       {
                           "term":  "cost boundary",
                           "meaning":  "the precise concept required for cost warning"
                       },
                       {
                           "term":  "verified evidence",
                           "meaning":  "an observation supported by a reproducible check"
                       }
                   ],
    "expectedElements":  [
                             "A clear decision tied to the scenario",
                             "Verified evidence and one explicit limitation",
                             "A named next action"
                         ],
    "modelAnswer":  "Decision: A budget produces notifications but is not a universal spending stop, so duration, size and deletion are also controlled. Evidence: the documented local checks support this scope. Limitation: this does not prove behavior in an untested production environment. Next action: record the owner and the next bounded verification.",
    "commonMistakes":  [
                           "Using confident adjectives without naming evidence or a limitation"
                       ],
    "variants":  [
                     "Rewrite the update for a non-technical stakeholder without removing the limitation."
                 ],
    "license":  "CC-BY-4.0"
}
