{
    "schemaVersion":  1,
    "id":  "english-card-13-spoken",
    "version":  1,
    "title":  "Actionable alert — spoken follow-up",
    "level":  "B2",
    "durationMinutes":  10,
    "skills":  [
                   "english.spoken",
                   "observability.alerts"
               ],
    "situation":  "In a technical discussion, an alert has no owner or runbook. You must answer aloud accurately without overstating the evidence.",
    "instructions":  [
                         "Deliver a sixty-second answer with decision, evidence, limitation and one clarifying question."
                     ],
    "vocabulary":  [
                       {
                           "term":  "alert design",
                           "meaning":  "the precise concept required for actionable alert"
                       },
                       {
                           "term":  "verified evidence",
                           "meaning":  "an observation supported by a reproducible check"
                       }
                   ],
    "expectedElements":  [
                             "A clear decision tied to the scenario",
                             "Verified evidence and one explicit limitation",
                             "One useful clarifying question"
                         ],
    "modelAnswer":  "My decision is that The alert needs a user symptom, window, threshold, severity, owner and safe first action before it is enabled. The current evidence is limited to the documented checks, so I would not claim more. Which constraint or observation would make us revisit this decision?",
    "commonMistakes":  [
                           "Using confident adjectives without naming evidence or a limitation"
                       ],
    "variants":  [
                     "Answer again after the reviewer changes one cost or security constraint."
                 ],
    "license":  "CC-BY-4.0"
}
