{
    "schemaVersion":  1,
    "id":  "english-card-11-spoken",
    "version":  1,
    "title":  "Metric choice — spoken follow-up",
    "level":  "B2",
    "durationMinutes":  10,
    "skills":  [
                   "english.spoken",
                   "observability.signals"
               ],
    "situation":  "In a technical discussion, a teammate wants a log line for every latency sample. You must answer aloud accurately without overstating the evidence.",
    "instructions":  [
                         "Deliver a sixty-second answer with decision, evidence, limitation and one clarifying question."
                     ],
    "vocabulary":  [
                       {
                           "term":  "signal selection",
                           "meaning":  "the precise concept required for metric choice"
                       },
                       {
                           "term":  "verified evidence",
                           "meaning":  "an observation supported by a reproducible check"
                       }
                   ],
    "expectedElements":  [
                             "A clear decision tied to the scenario",
                             "Verified evidence and one explicit limitation",
                             "One useful clarifying question"
                         ],
    "modelAnswer":  "My decision is that A latency histogram answers the trend question more efficiently, while a bounded event explains a specific failure. The current evidence is limited to the documented checks, so I would not claim more. Which constraint or observation would make us revisit this decision?",
    "commonMistakes":  [
                           "Using confident adjectives without naming evidence or a limitation"
                       ],
    "variants":  [
                     "Answer again after the reviewer changes one cost or security constraint."
                 ],
    "license":  "CC-BY-4.0"
}
