{
    "schemaVersion":  1,
    "id":  "english-card-24-spoken",
    "version":  1,
    "title":  "CV evidence — spoken follow-up",
    "level":  "C1",
    "durationMinutes":  10,
    "skills":  [
                   "english.spoken",
                   "career.cv"
               ],
    "situation":  "In a technical discussion, a project needs a concise CV line. You must answer aloud accurately without overstating the evidence.",
    "instructions":  [
                         "Deliver a sixty-second answer with decision, evidence, limitation and one clarifying question."
                     ],
    "vocabulary":  [
                       {
                           "term":  "verifiable achievement",
                           "meaning":  "the precise concept required for cv evidence"
                       },
                       {
                           "term":  "verified evidence",
                           "meaning":  "an observation supported by a reproducible check"
                       }
                   ],
    "expectedElements":  [
                             "A clear decision tied to the scenario",
                             "Verified evidence and one explicit limitation",
                             "One useful clarifying question"
                         ],
    "modelAnswer":  "My decision is that I describe it as a personal project, state my action and cite a reproducible test result without inventing users or business impact. The current evidence is limited to the documented checks, so I would not claim more. Which constraint or observation would make us revisit this decision?",
    "commonMistakes":  [
                           "Using confident adjectives without naming evidence or a limitation"
                       ],
    "variants":  [
                     "Answer again after the reviewer changes one cost or security constraint."
                 ],
    "license":  "CC-BY-4.0"
}
